"CD_AnnotatedMembers","CD_AnnotatedMembers_Overlap","CD_AnnotatedMembers_Pvalue","CD_AnnotatedMembers_Size","CD_CommunityName","CD_Labeled","CD_MemberList","CD_MemberList_LogSize","CD_MemberList_Size","level","name","selected","shared name"
,"0.0","0.0","0",,"false","AbstractPhotoController AbstractPhotoController.EnvironmentChangeListener AbstractPhotoController.Property AppletApplication AppletApplication.AppletBasicService AppletApplication.AppletFurnitureTable AppletApplication.StandaloneServiceManager AppletContentManager AppletUserPreferences AspectRatio AutoCommitSpinner AutoCommitSpinner.SpinnerModuloNumberModel AutoCompleteTextField AutoRecoveryManager BackgroundImage BackgroundImageWizardController BackgroundImageWizardController.BackgroundImageUndoableEdit BackgroundImageWizardController.BackgroundImageWizardStepState BackgroundImageWizardController.ImageChoiceStepState BackgroundImageWizardController.ImageOriginStepState BackgroundImageWizardController.ImageScaleStepState BackgroundImageWizardController.Property BackgroundImageWizardController.Step BackgroundImageWizardStepsPanel BackgroundImageWizardStepsPanel.OriginImagePreviewComponent BackgroundImageWizardStepsPanel.ScaleImagePreviewComponent BackgroundImageWizardStepsPanel.ScaleImagePreviewComponent.ActionType Base64 Base64.OutputStream Baseboard BaseboardChoiceComponent BaseboardChoiceController BaseboardChoiceController.BaseboardPaint BaseboardChoiceController.Property Camera Camera.Lens Camera.Property CatalogDoorOrWindow CatalogItem CatalogItemToolTip CatalogItemToolTip.DisplayedInformation CatalogLight CatalogPieceOfFurniture CatalogTexture CollectionChangeSupport CollectionEvent CollectionEvent.Type CollectionListener ColorButton ColorButton.ColorChart ColorButton.ColorCode ColorButton.GrayColorChart ColorButton.PaletteComboBox ColorButton.PalettesColorChooserPanel ColorButton.RecentColorsPanel Compass Compass.GeographicPoint Compass.Property CompassController CompassController.CompassUndoableEdit CompassController.Property CompassPanel Component3DManager Component3DManager.ObservedCanvas3D Component3DManager.RenderingErrorListenerManager Component3DManager.RenderingErrorObserver Component3DManager.RenderingObserver Content ContentDigestManager ContentDigestManager.ZipEntryData ContentManager ContentManager.ContentType ContentRecording Controller ControllerAction DAELoader DAELoader.DAEHandler DamagedHomeIOException DamagedHomeRecorderException DefaultFurnitureCatalog DefaultFurnitureCatalog.PropertyKey DefaultHomeInputStream DefaultHomeInputStream.CopiedInputStream DefaultHomeInputStream.HomeObjectInputStream DefaultHomeOutputStream DefaultHomeOutputStream.HomeContentObjectsTracker DefaultHomeOutputStream.HomeObjectOutputStream DefaultLibrary DefaultPatternTexture DefaultTexturesCatalog DefaultTexturesCatalog.PropertyKey DefaultUserPreferences DialogView DimensionLine DimensionLine.Property DoorOrWindow Elevatable ExportableView ExportableView.FormatType ExtensionsClassLoader FileContentManager FileContentManager.DirectoryChooser FileContentManager.DirectoryChooser.DirectoryNode FileUserPreferences FileUserPreferences.PortablePreferences FileUserPreferences.PreferencesURLContent FontNameComboBox FurnitureCatalog FurnitureCatalogController FurnitureCatalogController.AddedFurnitureSelector FurnitureCatalogController.FurnitureCatalogChangeListener FurnitureCatalogController.FurnitureCatalogViewChangeListener FurnitureCatalogListPanel FurnitureCatalogListPanel.CatalogCellRenderer FurnitureCatalogListPanel.FurnitureCatalogListModel FurnitureCatalogListPanel.FurnitureCatalogListModel.FurnitureCatalogListener FurnitureCatalogListPanel.PreferencesChangeListener FurnitureCatalogTransferHandler FurnitureCatalogTree FurnitureCatalogTree.CatalogCellRenderer FurnitureCatalogTree.CatalogTreeModel FurnitureCatalogTree.CatalogTreeModel.CatalogFurnitureListener FurnitureCategory FurnitureController FurnitureController.AlignedPieceOfFurniture FurnitureController.AlignmentAction FurnitureTable FurnitureTable.FurnitureFilter FurnitureTable.FurnitureTableColumnModel FurnitureTable.FurnitureTableColumnModel.LanguageChangeListener FurnitureTable.FurnitureTableColumnModel.PriceRenderer FurnitureTable.FurnitureTreeTableModel FurnitureTable.RunnableContext FurnitureTable.TreeTableNameCellRenderer FurnitureTable.TreeTableNameCellRenderer.PanelWithInformationIcon FurnitureTable.UserPreferencesChangeListener FurnitureTransferHandler Ground3D Ground3D.LevelAreas HelpController HelpController.HelpDocument HelpController.HelpDocument.HelpReader HelpController.LanguageChangeListener HelpController.Property HelpPane HelpPane.ActionType HelpPane.LanguageChangeListener HelpView Home Home.Property Home3DAttributesController Home3DAttributesController.EnvironmentPaint Home3DAttributesController.Home3DAttributesModificationUndoableEdit Home3DAttributesController.Property Home3DAttributesPanel HomeAppletController HomeAppletRecorder HomeAppletRecorder.LengthOutputStream HomeApplication HomeComponent3D HomeComponent3D.ActionType HomeComponent3D.CameraInterpolator HomeComponent3D.ElevateCameraAction HomeComponent3D.JCanvas3DWithNavigationPanel HomeComponent3D.MoveCameraAction HomeComponent3D.MoveCameraSidewaysAction HomeComponent3D.NavigationButton HomeComponent3D.NavigationPanelChangeListener HomeComponent3D.RotateCameraPitchAction HomeComponent3D.RotateCameraYawAction HomeContentContext HomeController HomeController.FurnitureCatalogChangeListener HomeController.LanguageChangeListener HomeController.TexturesCatalogChangeListener HomeController.Update HomeController.UpdatesHandler HomeController.UserPreferencesChangeListener HomeController.UserPreferencesPropertiesChangeListener HomeController3D HomeController3D.CameraControllerState HomeController3D.ObserverCameraState HomeController3D.TopCameraState HomeController3D.UserPreferencesChangeListener HomeDescriptor HomeDoorOrWindow HomeEnvironment HomeEnvironment.DrawingMode HomeEnvironment.Property HomeFileRecorder HomeFrameController HomeFramePane HomeFramePane.LanguageChangeListener HomeFurnitureController HomeFurnitureController.FurnitureHorizontalAxis HomeFurnitureController.FurnitureModificationUndoableEdit HomeFurnitureController.FurniturePaint HomeFurnitureController.FurnitureShininess HomeFurnitureController.ModifiedDoorOrWindow HomeFurnitureController.ModifiedFurnitureGroup HomeFurnitureController.ModifiedLight HomeFurnitureController.ModifiedPieceOfFurniture HomeFurnitureController.Property HomeFurnitureGroup HomeFurnitureGroup.LocationAndSizeChangeListener HomeFurniturePanel HomeLight HomeLight.Property HomeMaterial HomeObject HomePDFPrinter HomePane HomePane.ActionAdapter HomePane.FocusCycleRootChangeListener HomePane.FocusOwnerChangeListener HomePane.FurnitureCatalogViewChangeListener HomePane.LanguageChangeListener HomePane.MenuActionType HomePane.MouseAndFocusListener HomePane.OBJExporter HomePane.RulersVisibilityChangeListener HomePieceOfFurniture HomePieceOfFurniture.SortableProperty HomePieceOfFurniture3D HomePieceOfFurniture3D.DefaultMaterialAndTexture HomePieceOfFurniture3D.LightSelectionListener HomePluginController HomePrint HomePrint.PaperOrientation HomePrintableComponent HomePrintableComponent.Variable HomeRecorder HomeRecorder.Type HomeTexture HomeTransferableList HomeURLContent HomeView HomeView.ActionType HomeView.OpenDamagedHomeAnswer HomeView.SaveAnswer HomeXMLExporter HomeXMLExporter.PieceOfFurnitureExporter HomeXMLHandler HomeXMLHandler.JoinedWall IconManager IconManager.IconProxy ImportedFurnitureWizardController ImportedFurnitureWizardController.FurnitureAttributesStepState ImportedFurnitureWizardController.FurnitureIconStepState ImportedFurnitureWizardController.FurnitureModelStepState ImportedFurnitureWizardController.FurnitureOrientationStepState ImportedFurnitureWizardController.ImportedFurnitureWizardStepState ImportedFurnitureWizardController.PieceOfFurnitureImportationUndoableEdit ImportedFurnitureWizardController.Property ImportedFurnitureWizardController.Step ImportedFurnitureWizardStepsPanel ImportedFurnitureWizardStepsPanel.AbstractModelPreviewComponent ImportedFurnitureWizardStepsPanel.AttributesPreviewComponent ImportedFurnitureWizardStepsPanel.AutoRepeatButton ImportedFurnitureWizardStepsPanel.IconPreviewComponent ImportedFurnitureWizardStepsPanel.RotationPreviewComponent ImportedFurnitureWizardStepsView ImportedTextureWizardController ImportedTextureWizardController.ImportedTextureWizardStepState ImportedTextureWizardController.Property ImportedTextureWizardController.Step ImportedTextureWizardController.TextureAttributesStepState ImportedTextureWizardController.TextureImageStepState ImportedTextureWizardStepsPanel InterruptedPrinterException InterruptedRecorderException Label Label.Property Label3D LabelController LabelController.LabelCreationUndoableEdit LabelController.LabelModificationUndoableEdit LabelController.ModifiedLabel LabelController.Property LabelPanel LengthUnit LengthUnit.InchDecimalsFormat LengthUnit.MeterFamilyFormat LengthUnit.SquareFootAreaFormatWithUnit LengthUnit.SquareMeterAreaFormatWithUnit Level Level.Property LevelController LevelController.LevelModificationUndoableEdit LevelController.ModifiedLevel LevelController.Property LevelPanel LevelPanel.LevelsTableModel Library Light LightSource LocatedTransferHandler MacOSXConfiguration Max3DSLoader Max3DSLoader.Chunk3DS Max3DSLoader.ChunkID Max3DSLoader.ChunksInputStream Max3DSLoader.Face3DS Max3DSLoader.Material3DS Max3DSLoader.Mesh3DS Max3DSLoader.Mesh3DSSharedVertex ModelManager ModelManager.ModelObserver ModelManager.SVGPathSupport ModelMaterialsComponent ModelMaterialsComponent.ModelMaterialsPanel ModelMaterialsComponent.ModelMaterialsPanel.MaterialBlinker ModelMaterialsComponent.ModelMaterialsPanel.MaterialListCellRenderer ModelMaterialsComponent.ModelMaterialsPanel.MaterialsListModel ModelMaterialsController ModelMaterialsController.Property ModelPreviewComponent ModelPreviewComponent.JCanvas3DWithNotifiedPaint MultipleLevelsPlanPanel MultipleLevelsPlanPanel.LanguageChangeListener MultipleLevelsPlanPanel.LevelLabel NotEnoughSpaceRecorderException NullableCheckBox NullableSpinner NullableSpinner.NullableSpinnerLengthModel NullableSpinner.NullableSpinnerModuloNumberModel NullableSpinner.NullableSpinnerNumberModel OBJLoader OBJLoader.Face OBJLoader.Geometry OBJLoader.Group OBJLoader.Line OBJMaterial OBJWriter OBJWriter.ComparableAppearance Object3DBranch Object3DBranch.TextureKey Object3DBranchFactory Object3DFactory ObjectXMLExporter ObserverCamera ObserverCamera.Property ObserverCameraController ObserverCameraController.Property ObserverCameraPanel OperatingSystem PageSetupController PageSetupController.HomePrintModificationUndoableEdit PageSetupController.Property PageSetupPanel PatternsCatalog PhotoController PhotoController.CameraChangeListener PhotoController.HomeCameraChangeListener PhotoController.Property PhotoPanel PhotoPanel.ActionType PhotoPanel.LanguageChangeListener PhotoRenderer PhotoRenderer.PhotoObject3DFactory PhotoRenderer.Quality PhotoRenderer.Triangle PhotoSizeAndQualityPanel PhotoSizeAndQualityPanel.LanguageChangeListener PhotosController PhotosController.HomeStoredCamerasChangeListener PhotosController.Property PhotosPanel PhotosPanel.ActionType PhotosPanel.CamerasListModel PhotosPanel.LanguageChangeListener PieceOfFurniture PlanComponent PlanComponent.IndicatorType PlanComponent.MoveSelectionAction PlanComponent.PaintMode PlanComponent.PieceOfFurnitureModelIcon PlanComponent.PieceOfFurniturePlanIcon PlanComponent.PieceOfFurnitureTopViewIcon PlanComponent.PlanRulerComponent PlanComponent.SVGSupport PlanComponent.SetAlignmentActivatedAction PlanComponent.SetDuplicationActivatedAction PlanComponent.SetEditionActivatedAction PlanComponent.ToggleMagnetismAction PlanComponent.UserPreferencesChangeListener PlanController PlanController.AbstractModeChangeState PlanController.AbstractPolylineState PlanController.AbstractRoomState PlanController.AbstractWallState PlanController.CameraElevationState PlanController.CameraPitchRotationState PlanController.CameraYawRotationState PlanController.CompassResizeState PlanController.CompassRotationState PlanController.ControllerState PlanController.DimensionLineCreationState PlanController.DimensionLineDrawingState PlanController.DimensionLineOffsetState PlanController.DimensionLineResizeState PlanController.DragAndDropState PlanController.EditableProperty PlanController.JoinedWall PlanController.LabelCreationState PlanController.LabelElevationState PlanController.LabelRotationState PlanController.LightPowerModificationState PlanController.Mode PlanController.PanningState PlanController.PieceOfFurnitureElevationState PlanController.PieceOfFurnitureHeightState PlanController.PieceOfFurnitureNameOffsetState PlanController.PieceOfFurnitureNameRotationState PlanController.PieceOfFurniturePitchRotationState PlanController.PieceOfFurnitureResizeState PlanController.PieceOfFurnitureRollRotationState PlanController.PieceOfFurnitureRotationState PlanController.PointMagnetizedToClosestWallOrRoomPoint PlanController.PointWithAngleMagnetism PlanController.PolylineCreationState PlanController.PolylineDrawingState PlanController.PolylineResizeState PlanController.Property PlanController.RectangleSelectionState PlanController.ResizedPieceOfFurniture PlanController.RoomAreaOffsetState PlanController.RoomAreaRotationState PlanController.RoomCreationState PlanController.RoomDrawingState PlanController.RoomNameOffsetState PlanController.RoomNameRotationState PlanController.RoomPointWithAngleMagnetism PlanController.RoomResizeState PlanController.SelectionMoveState PlanController.SelectionState PlanController.WallCreationState PlanController.WallDrawingState PlanController.WallPointWithAngleMagnetism PlanController.WallResizeState PlanTransferHandler PlanView PlanView.CursorType Plugin PluginAction PluginAction.Property PluginManager PluginManager.PluginLibrary Polyline Polyline.ArrowStyle Polyline.CapStyle Polyline.DashStyle Polyline.JoinStyle PolylineController PolylineController.ModifiedPolyline PolylineController.PolylinesModificationUndoableEdit PolylineController.Property PolylinePanel PolylinePanel.ArrowsStyle PrintPreviewController PrintPreviewPanel PrintPreviewPanel.ActionType PrintPreviewPanel.HigherInsetsButton ProportionalLayout RecorderException ResourceAction ResourceAction.AbstractDecoratedAction ResourceAction.ButtonAction ResourceAction.LanguageChangeListener ResourceAction.MenuItemAction ResourceAction.PopupMenuItemAction ResourceAction.ToolBarAction ResourceURLContent Room Room.Property Room3D RoomController RoomController.ModifiedRoom RoomController.ModifiedWall RoomController.ModifiedWallSide RoomController.Property RoomController.RoomPaint RoomController.RoomsAndWallSidesModificationUndoableEdit RoomController.WallSide RoomPanel Sash ScaledImageComponent Selectable SelectionEvent SelectionListener SimpleURLContent SweetHome3D SweetHome3D.FileContentManagerWithRecordedLastDirectories SweetHome3D.StandaloneBasicService SweetHome3D.StandaloneServiceManager SweetHome3D.StandaloneSingleInstanceService SweetHome3DApplet SweetHome3DBootstrap SweetHome3DViewer SwingTools SwingTools.BrowserSupport SwingTools.MenuItemsVisibilityListener SwingTools.SelectionOnFocusManager SwingViewFactory TemporaryURLContent TextStyle TextureChoiceComponent TextureChoiceComponent.TexturePanel TextureChoiceComponent.TexturePanel.TextureIcon TextureChoiceComponent.TexturePanel.TextureListCellRenderer TextureChoiceComponent.TexturePanel.TexturesCatalogListModel TextureChoiceComponent.TexturePanel.TexturesCatalogListModel.TexturesCatalogListener TextureChoiceComponent.TexturePanel.TexturesCatalogListener TextureChoiceController TextureChoiceController.Property TextureChoiceView TextureImage TextureManager TextureManager.ComparableTexture TextureManager.ComparableTextureAngleTuple TextureManager.RotatedContentKey TextureManager.TextureObserver TexturesCatalog TexturesCategory ThreadedTaskController ThreadedTaskController.ExceptionHandler ThreadedTaskPanel ThreadedTaskView TransferableView TransferableView.DataType TransferableView.TransferObserver URLContent URLContentClassLoader UnfocusableToolBar UserPreferences UserPreferences.PrefixedResourceBundle UserPreferences.Property UserPreferencesController UserPreferencesController.Property UserPreferencesPanel UserPreferencesPanel.AutoCommitLengthSpinner UserPreferencesPanel.SpinnerLengthModel UserPreferencesPanel.SupportedLanguagesChangeListener VideoController VideoController.HomeEnvironmentChangeListener VideoController.Property VideoPanel VideoPanel.ActionType VideoPanel.FrameGenerator VideoPanel.Image3DGenerator VideoPanel.ImageDataSource VideoPanel.ImageSourceStream VideoPanel.LanguageChangeListener VideoPanel.PhotoImageGenerator View ViewFactory ViewFactoryAdapter ViewerHelper VisualTransferHandler VisualTransferHandler.DragGestureRecognizerWithVisualRepresentation VisualTransferHandler.DragListenerWithVisualRepresentation Wall Wall.Property Wall3D Wall3D.DoorOrWindowArea Wall3D.ModelRotationTuple WallController WallController.ModifiedWall WallController.Property WallController.WallPaint WallController.WallShape WallController.WallsModificationUndoableEdit WallPanel WizardController WizardController.Property WizardController.WizardControllerStepState WizardPane XMLWriter","9.175","578","0","C38806","false","C38806"
,"0.0","0.0","0",,"false","PlanComponent.MoveSelectionAction PlanComponent.SetAlignmentActivatedAction PlanComponent.SetDuplicationActivatedAction PlanComponent.ToggleMagnetismAction PlanController PlanController.AbstractModeChangeState PlanController.AbstractWallState PlanController.CameraPitchRotationState PlanController.CompassRotationState PlanController.ControllerState PlanController.DimensionLineCreationState PlanController.DimensionLineDrawingState PlanController.DimensionLineOffsetState PlanController.DimensionLineResizeState PlanController.DragAndDropState PlanController.EditableProperty PlanController.LabelCreationState PlanController.LabelElevationState PlanController.LabelRotationState PlanController.Mode PlanController.PanningState PlanController.PieceOfFurnitureElevationState PlanController.PieceOfFurnitureNameOffsetState PlanController.PieceOfFurnitureNameRotationState PlanController.PieceOfFurniturePitchRotationState PlanController.PieceOfFurnitureRollRotationState PlanController.PieceOfFurnitureRotationState PlanController.PointWithAngleMagnetism PlanController.PolylineCreationState PlanController.Property PlanController.RectangleSelectionState PlanController.RoomAreaOffsetState PlanController.RoomAreaRotationState PlanController.RoomNameOffsetState PlanController.RoomNameRotationState PlanController.SelectionMoveState PlanController.WallCreationState PlanController.WallDrawingState PlanController.WallPointWithAngleMagnetism PlanController.WallResizeState PlanView","5.358","41",,"C38751","false","C38751"
,"0.0","0.0","0",,"false","HomeComponent3D HomeComponent3D.ActionType HomeComponent3D.JCanvas3DWithNavigationPanel HomeComponent3D.NavigationPanelChangeListener Object3DFactory PhotoPanel PhotoPanel.ActionType PhotoPanel.LanguageChangeListener PhotoRenderer PhotoRenderer.Quality PhotoRenderer.Triangle PhotoSizeAndQualityPanel PhotoSizeAndQualityPanel.LanguageChangeListener PhotosPanel PhotosPanel.ActionType PhotosPanel.LanguageChangeListener VideoPanel.FrameGenerator VideoPanel.Image3DGenerator VideoPanel.ImageDataSource VideoPanel.ImageSourceStream VideoPanel.PhotoImageGenerator","4.392","21",,"C38752","false","C38752"
,"0.0","0.0","0",,"false","FurnitureTransferHandler HomeController HomeController.FurnitureCatalogChangeListener HomeController.TexturesCatalogChangeListener HomeController.UserPreferencesChangeListener HomeController.UserPreferencesPropertiesChangeListener HomePane HomePane.FocusCycleRootChangeListener HomePane.FocusOwnerChangeListener HomePane.FurnitureCatalogViewChangeListener HomePane.LanguageChangeListener HomePane.MenuActionType HomePane.RulersVisibilityChangeListener HomeTransferableList LocatedTransferHandler PlanTransferHandler Plugin UnfocusableToolBar","4.17","18",,"C38753","false","C38753"
,"0.0","0.0","0",,"false","ImportedFurnitureWizardController ImportedFurnitureWizardController.FurnitureAttributesStepState ImportedFurnitureWizardController.FurnitureIconStepState ImportedFurnitureWizardController.FurnitureModelStepState ImportedFurnitureWizardController.FurnitureOrientationStepState ImportedFurnitureWizardController.ImportedFurnitureWizardStepState ImportedFurnitureWizardController.PieceOfFurnitureImportationUndoableEdit ImportedFurnitureWizardController.Property ImportedFurnitureWizardController.Step ImportedFurnitureWizardStepsPanel ImportedFurnitureWizardStepsPanel.AbstractModelPreviewComponent ImportedFurnitureWizardStepsPanel.AttributesPreviewComponent ImportedFurnitureWizardStepsPanel.AutoRepeatButton ImportedFurnitureWizardStepsPanel.IconPreviewComponent ImportedFurnitureWizardStepsPanel.RotationPreviewComponent ImportedFurnitureWizardStepsView ModelPreviewComponent ModelPreviewComponent.JCanvas3DWithNotifiedPaint","4.17","18",,"C38754","false","C38754"
,"0.0","0.0","0",,"false","Component3DManager Component3DManager.ObservedCanvas3D Component3DManager.RenderingErrorListenerManager Component3DManager.RenderingErrorObserver Component3DManager.RenderingObserver OperatingSystem ResourceAction.AbstractDecoratedAction ResourceAction.ButtonAction ResourceAction.MenuItemAction ResourceAction.PopupMenuItemAction ResourceAction.ToolBarAction SweetHome3D.StandaloneBasicService SweetHome3D.StandaloneServiceManager SweetHome3D.StandaloneSingleInstanceService VisualTransferHandler VisualTransferHandler.DragGestureRecognizerWithVisualRepresentation VisualTransferHandler.DragListenerWithVisualRepresentation","4.087","17",,"C38755","false","C38755"
,"0.0","0.0","0",,"false","DAELoader DAELoader.DAEHandler HomeMaterial HomePieceOfFurniture3D HomePieceOfFurniture3D.DefaultMaterialAndTexture HomePieceOfFurniture3D.LightSelectionListener LightSource ModelManager ModelManager.ModelObserver ModelManager.SVGPathSupport ModelMaterialsComponent ModelMaterialsComponent.ModelMaterialsPanel ModelMaterialsComponent.ModelMaterialsPanel.MaterialBlinker ModelMaterialsComponent.ModelMaterialsPanel.MaterialListCellRenderer ModelMaterialsComponent.ModelMaterialsPanel.MaterialsListModel ModelMaterialsController ModelMaterialsController.Property","4.087","17",,"C38756","false","C38756"
,"0.0","0.0","0",,"false","CatalogPieceOfFurniture CollectionChangeSupport CollectionEvent CollectionEvent.Type CollectionListener DefaultFurnitureCatalog FurnitureCatalog FurnitureCatalogController.AddedFurnitureSelector FurnitureCatalogController.FurnitureCatalogChangeListener FurnitureCatalogListPanel FurnitureCatalogListPanel.FurnitureCatalogListModel FurnitureCatalogListPanel.FurnitureCatalogListModel.FurnitureCatalogListener FurnitureCatalogListPanel.PreferencesChangeListener FurnitureCatalogTree.CatalogTreeModel FurnitureCatalogTree.CatalogTreeModel.CatalogFurnitureListener FurnitureCategory TextureChoiceComponent.TexturePanel.TexturesCatalogListener","4.087","17",,"C38757","false","C38757"
,"0.0","0.0","0",,"false","AppletApplication AutoRecoveryManager HomeAppletController HomeApplication HomeFrameController HomeFramePane HomeFramePane.LanguageChangeListener HomePluginController HomeRecorder HomeRecorder.Type HomeView HomeView.ActionType HomeView.OpenDamagedHomeAnswer HomeView.SaveAnswer MacOSXConfiguration PluginManager SweetHome3D","4.087","17",,"C38758","false","C38758"
,"0.0","0.0","0",,"false","AutoCommitSpinner.SpinnerModuloNumberModel AutoCompleteTextField BaseboardChoiceComponent ColorButton CompassPanel HomeFurniturePanel LabelPanel LevelPanel NullableCheckBox NullableSpinner NullableSpinner.NullableSpinnerLengthModel NullableSpinner.NullableSpinnerModuloNumberModel NullableSpinner.NullableSpinnerNumberModel PolylinePanel RoomPanel WallPanel","4.0","16",,"C38759","false","C38759"
,"0.0","0.0","0",,"false","CatalogLight HomeFurnitureController HomeFurnitureController.FurnitureHorizontalAxis HomeFurnitureController.FurnitureModificationUndoableEdit HomeFurnitureController.FurniturePaint HomeFurnitureController.FurnitureShininess HomeFurnitureController.ModifiedDoorOrWindow HomeFurnitureController.ModifiedFurnitureGroup HomeFurnitureController.ModifiedLight HomeFurnitureController.ModifiedPieceOfFurniture HomeFurnitureController.Property HomeLight HomeLight.Property Light PlanController.LightPowerModificationState","3.907","15",,"C38760","false","C38760"
,"0.0","0.0","0",,"false","ExportableView.FormatType MultipleLevelsPlanPanel MultipleLevelsPlanPanel.LanguageChangeListener PlanComponent PlanComponent.IndicatorType PlanComponent.PaintMode PlanComponent.PieceOfFurnitureModelIcon PlanComponent.PieceOfFurniturePlanIcon PlanComponent.PieceOfFurnitureTopViewIcon PlanComponent.PlanRulerComponent PlanComponent.SVGSupport PlanComponent.SetEditionActivatedAction PlanComponent.UserPreferencesChangeListener PlanView.CursorType Sash","3.907","15",,"C38761","false","C38761"
,"0.0","0.0","0",,"false","Base64 Base64.OutputStream ContentRecording DefaultHomeInputStream DefaultHomeInputStream.CopiedInputStream DefaultHomeInputStream.HomeObjectInputStream HomeAppletRecorder HomeAppletRecorder.LengthOutputStream HomeContentContext HomeFileRecorder HomeXMLHandler InterruptedRecorderException NotEnoughSpaceRecorderException RecorderException ViewerHelper","3.907","15",,"C38762","false","C38762"
